[{
  "destination_host": {},
  "destination_port": {
    "enum": [
      1833,
      8883
    ]
  },
  "broker_topic": {
    "enum": [
      "fixedTopicName1",
      "fixedTopicName2"
    ]
  },
  "broker_protocol": {
    "enum": [
      true,
      false
    ]
  },
  "broker_authorization": {
    "enum": [
      true,
      false
    ]
  },
  "connection_status_broker_topic": {
    "enum": [
      "connStatusTopic"
    ]
  }
}]
